{
  "$schema": "http://json-schema.org/draft-07/schema#",
  "$id": "panlabs-aws-diagrams/elaboracao@1",
  "title": "Elaboração — o delta da fase técnica sobre o modelo aprovado",
  "description": "NÃO é um segundo modelo. É o que a fase técnica ACRESCENTA ao `sessao@1` que a sessão anterior aprovou — sessao/elaborar.cjs aplica este delta e devolve outro `sessao@1`. Nenhum campo daqui alcança um casaco lógico: a fase técnica não inventa capacidade, e essa regra é gramática (esquema fechado), não disciplina de quem escreve. A forma está descrita em guia/modelo.md; o corpus tem dois exemplos completos em modelo/sessao/*-elaboracao.json.\n\nOs mapas (`casacos`, `dentro`, `refina`, `arestasCasaco`) ficam com valor `object` solto: as chaves são ids de nó/aresta aprovados, imprevisíveis aqui. A forma de cada valor — em particular a de um casaco técnico — é validada de novo, junto com o resto do modelo fundido, por sessao/validar.cjs contra `sessao@1` (que TEM `casacoTecnico` fechado). Duplicar aquele fechamento aqui seria uma terceira cópia da mesma decisão — e cada cópia é mais um lugar para as três divergirem em silêncio, que é a classe de defeito que este próprio ticket existe para fechar (ver tests/check-paridade-tecnica.cjs).",
  "type": "object",
  "additionalProperties": false,
  "required": ["esquema", "sobre"],
  "properties": {
    "esquema": { "const": "panlabs-aws-diagrams/elaboracao@1" },
    "sobre": {
      "$ref": "#/definitions/identificador",
      "description": "Id do modelo `sessao@1` sobre o qual este delta se aplica. elaborar.cjs recusa se não bater com o modelo aberto."
    },
    "titulo": { "type": "string" },
    "subtitulo": { "type": "string" },

    "_": { "type": "string", "description": "Comentário livre sobre o delta inteiro. Não lido por elaborar.cjs." },
    "_reparenta": { "type": "string", "description": "Comentário livre sobre o bloco `dentro`. Não lido por elaborar.cjs." },
    "_arestas": { "type": "string", "description": "Comentário livre sobre o bloco `arestas`. Não lido por elaborar.cjs." },
    "_refina": { "type": "string", "description": "Comentário livre sobre o bloco `refina`. Não lido por elaborar.cjs." },

    "nos": {
      "type": "array",
      "default": [],
      "items": { "$ref": "#/definitions/noNovo" },
      "description": "Infraestrutura nova (VPC, subnet, endpoint, papel de IAM...). camada:\"tecnica\" é obrigatória — tudo que a elaboração acrescenta é infraestrutura, nunca capacidade."
    },

    "casacos": {
      "type": "object",
      "description": "{ id: casacoTecnico }. Veste um nó JÁ APROVADO de serviço AWS. Cada valor tem a forma de `casacoTecnico` (sessao@1) — validada depois do merge, não aqui."
    },

    "dentro": {
      "type": "object",
      "description": "{ id: novoPai }. Reparenta um nó aprovado para dentro de um nível que só a camada técnica tem — a operação de risco: a projeção lógica tem de sair idêntica mesmo assim."
    },

    "refina": {
      "type": "object",
      "description": "{ idAresta: { por: [ids], rotulos: [...] } }. Transforma uma aresta aprovada num CAMINHO técnico, declarando os saltos — os extremos continuam sendo os mesmos objetos, e a contração da projeção reconstrói o par original."
    },

    "arestas": {
      "type": "array",
      "default": [],
      "items": { "$ref": "#/definitions/arestaNova" },
      "description": "Aresta que só a camada técnica tem — plumbing que a vista lógica não afirmou."
    },

    "arestasCasaco": {
      "type": "object",
      "description": "{ idAresta: { rotulo, protocolo, ordem } }. Dá rótulo técnico a uma aresta aprovada, sem mexer nos extremos."
    },

    "notas": {
      "type": "array",
      "default": [],
      "items": { "$ref": "#/definitions/nota" }
    },

    "dossie": {
      "type": "object",
      "description": "Mesma forma de dossie.estacionamento e dossie.achados em sessao@1 — elaborar.cjs funde por chave (nome/regra+alvo) em vez de substituir a lista inteira."
    }
  },

  "definitions": {
    "identificador": {
      "type": "string",
      "pattern": "^[a-z0-9][a-z0-9-]*$",
      "maxLength": 64
    },

    "noNovo": {
      "type": "object",
      "additionalProperties": false,
      "required": ["id", "camada", "tecnico"],
      "properties": {
        "id": { "$ref": "#/definitions/identificador" },
        "camada": {
          "const": "tecnica",
          "description": "Único valor aceito num nó novo da elaboração — elaborar.cjs recusa qualquer outro (inclusive ausência, que herdaria \"ambas\"). Nó novo é sempre infraestrutura."
        },
        "dentro": { "$ref": "#/definitions/identificador" },
        "tecnico": {
          "type": "object",
          "description": "Casaco técnico do nó novo — forma de `casacoTecnico` (sessao@1), validada depois do merge."
        }
      }
    },

    "arestaNova": {
      "type": "object",
      "additionalProperties": false,
      "required": ["de", "para"],
      "properties": {
        "id": { "$ref": "#/definitions/identificador" },
        "de": { "$ref": "#/definitions/identificador" },
        "para": { "$ref": "#/definitions/identificador" },
        "rotulo": { "type": "string" },
        "protocolo": { "type": "string" },
        "camada": { "enum": ["ambas", "tecnica"], "default": "ambas" },
        "dados": { "enum": ["ida", "volta", "ambos"], "default": "ida" },
        "ordem": { "type": "integer", "minimum": 1 }
      }
    },

    "nota": {
      "type": "object",
      "additionalProperties": false,
      "required": ["texto"],
      "properties": {
        "id": { "$ref": "#/definitions/identificador" },
        "texto": { "type": "string", "minLength": 1 },
        "sobre": { "$ref": "#/definitions/identificador" },
        "camada": { "enum": ["ambas", "tecnica"], "default": "ambas" },
        "origem": { "enum": ["achado-recusado", "premissa", "legenda"] }
      }
    }
  }
}
