{
  "esquema": "panlabs-aws-diagrams/elaboracao@1",
  "sobre": "frota-preditiva",
  "_": "O delta da fase técnica do caso ponta a ponta do #26. Difere do varejo de propósito em duas coisas que exercitam caminhos diferentes do motor: as fronteiras viram GRUPO e não conta (conta única, então o caminho é o do ELK e não o das contas), e o nível de rede que a vista lógica não tem entra numa fronteira só.",

  "nos": [
    { "id": "nuvem", "camada": "tecnica", "tecnico": { "tipo": "nuvem", "rotulo": "AWS Cloud" } },

    { "id": "vpc-modelo", "camada": "tecnica", "dentro": "analise",
      "tecnico": { "tipo": "vpc", "rotulo": "VPC de inferência · 10.30.0.0/16", "cidr": "10.30.0.0/16" } },

    { "id": "sub-modelo", "camada": "tecnica", "dentro": "vpc-modelo",
      "tecnico": { "tipo": "subnet", "rotulo": "Private subnet", "acesso": "privada", "cidr": "10.30.1.0/24" } },

    { "id": "endpoint-s3", "camada": "tecnica", "dentro": "sub-modelo",
      "tecnico": { "tipo": "servico", "servico": "endpoints", "rotulo": "VPC endpoint (S3)" } }
  ],

  "casacos": {
    "veiculo": { "tipo": "ator", "servico": "users", "rotulo": "Caminhões" },
    "oficina": { "tipo": "ator", "servico": "users", "rotulo": "Oficinas" },

    "coleta":  { "tipo": "grupo", "rotulo": "Coleta" },
    "analise": { "tipo": "grupo", "rotulo": "Análise" },
    "acao":    { "tipo": "grupo", "rotulo": "Ação" },

    "receber-telemetria": { "tipo": "servico", "servico": "kinesis", "rotulo": "Kinesis Data Streams" },
    "guardar-serie":      { "tipo": "servico", "servico": "timestream", "rotulo": "Timestream" },
    "detectar-anomalia":  { "tipo": "servico", "servico": "lambda", "rotulo": "Lambda · janela e regra" },
    "pontuar-risco":      { "tipo": "servico", "servico": "sagemaker", "rotulo": "SageMaker · endpoint de inferência" },
    "abrir-ordem":        { "tipo": "servico", "servico": "step functions", "rotulo": "Step Functions · abertura de ordem" },
    "avisar-oficina":     { "tipo": "servico", "servico": "sns", "rotulo": "SNS · tópico de alerta" }
  },

  "_reparenta": "A operação de risco, isolada aqui para ficar visível na revisão: `pontuar-risco` foi APROVADO dentro de `analise`, e a fase técnica o empurra dois níveis para baixo, para dentro de uma sub-rede que a vista lógica não conhece. A projeção lógica tem de sair byte a byte idêntica assim mesmo — é o colapso de contenção do #14, e é o que `conferir()` mede no passo 6.",
  "dentro": {
    "coleta": "nuvem",
    "analise": "nuvem",
    "acao": "nuvem",
    "pontuar-risco": "sub-modelo"
  },

  "_arestas": "Como o modelo alcança o objeto é detalhe técnico. A vista lógica diz \"anomalia encontrada, pontua\" e foi isso que a diretoria aprovou.",
  "arestas": [
    { "id": "a-artefato", "de": "pontuar-risco", "para": "endpoint-s3", "camada": "tecnica",
      "rotulo": "carrega o artefato do modelo", "dados": "volta" }
  ],

  "arestasCasaco": {
    "a-envia": { "rotulo": "PutRecord · 30 s" },
    "a-le": { "rotulo": "consulta a janela de 24 h" }
  },

  "notas": [
    { "id": "n-buffer", "camada": "tecnica", "origem": "premissa",
      "texto": "Retenção de 24 h no fluxo: cobre os 30 min de buffer do veículo com folga, e é o que sustenta o SPOF aceito na recepção." }
  ],

  "dossie": {
    "estacionamento": [
      { "nome": "Kinesis", "capacidade": "receber-telemetria", "estado": "devolvido",
        "nota": "voltou na fase técnica como sugestão inferida contra a capacidade, e foi confirmado (#15 §5)." },
      { "nome": "SageMaker", "capacidade": "pontuar-risco", "estado": "devolvido",
        "nota": "voltou e foi confirmado — é ele que vive dentro da sub-rede privada." }
    ]
  }
}
